{
  "schema_version": "1.0.0",
  "context_id": "governance-context.round-06.worker-transition.synthetic",
  "classification": "synthetic-research-only",
  "captured_at": "2026-09-09T00:00:00Z",
  "source_bundle_binding": {
    "bundle_id": "bundle.round-04.worker-option.complete",
    "bundle_sha256": "sha256:7875e2ff45ebe004f972d8e435da5bfaed50919a2ebc0232724e07426d08e5ca",
    "bundle_as_of": "2026-09-09T00:00:00Z",
    "evaluation_hash": "sha256:dbbe5b2edb8a9215d3cd5dec71fabf5ceb6d6de129900152e23aab5c44046ba0",
    "condition_definition_ref": {
      "condition_id": "condition.worker-option.nsw",
      "definition_version": "1.0.0",
      "definition_hash": "sha256:f5e2e2a299529dc890c70ef36b2e95ba9408b0e6a4d76a249b8b60810e9781e2"
    },
    "computed_rule_state": "true"
  },
  "participants": [
    {
      "actor_id": "actor.worker-representative.synthetic",
      "label": "Synthetic affected-worker representative",
      "roles": [
        "affected-party-representative",
        "negotiator"
      ],
      "identity_verification": "synthetic-unverified"
    },
    {
      "actor_id": "actor.household-representative.synthetic",
      "label": "Synthetic worker-household representative",
      "roles": [
        "affected-party-representative",
        "negotiator"
      ],
      "identity_verification": "synthetic-unverified"
    },
    {
      "actor_id": "actor.transition-provider.synthetic",
      "label": "Synthetic transition-support provider",
      "roles": [
        "candidate-action-owner",
        "negotiator"
      ],
      "identity_verification": "synthetic-unverified"
    },
    {
      "actor_id": "actor.public-authority-candidate.synthetic",
      "label": "Synthetic candidate public authority",
      "roles": [
        "candidate-authority-holder",
        "negotiator"
      ],
      "identity_verification": "synthetic-unverified"
    }
  ],
  "affected_consumers": [
    {
      "consumer_id": "consumer.affected-workers.synthetic",
      "label": "Synthetic affected workers",
      "affected_how": "Work, earnings, conditions, refusal rights and access to review may change.",
      "materiality": "direct"
    },
    {
      "consumer_id": "consumer.worker-households.synthetic",
      "label": "Synthetic worker households",
      "affected_how": "Household income continuity and care arrangements may change.",
      "materiality": "indirect-material"
    }
  ],
  "representations": [
    {
      "representation_id": "representation.affected-workers.synthetic",
      "consumer_id": "consumer.affected-workers.synthetic",
      "representative_actor_id": "actor.worker-representative.synthetic",
      "selection_basis": "Synthetic placeholder. No election, sampling or identity check occurred.",
      "mandate_scope": "Record worker safeguards, objections and requested changes only.",
      "mandate_expires_at": "2026-10-01T00:00:00Z",
      "mandate_verification": "synthetic-unverified",
      "consent_established": false,
      "challenge_route": {
        "route_id": "challenge.affected-workers.synthetic",
        "receiving_actor_ids": [
          "actor.transition-provider.synthetic",
          "actor.public-authority-candidate.synthetic"
        ],
        "channel_description": "Synthetic dual-recipient route. No live channel or response service exists.",
        "effect": "pause-and-record-only"
      }
    },
    {
      "representation_id": "representation.worker-households.synthetic",
      "consumer_id": "consumer.worker-households.synthetic",
      "representative_actor_id": "actor.household-representative.synthetic",
      "selection_basis": "Synthetic placeholder. No household mandate or identity check occurred.",
      "mandate_scope": "Record household continuity concerns and objections only.",
      "mandate_expires_at": "2026-10-01T00:00:00Z",
      "mandate_verification": "synthetic-unverified",
      "consent_established": false,
      "challenge_route": {
        "route_id": "challenge.worker-households.synthetic",
        "receiving_actor_ids": [
          "actor.transition-provider.synthetic",
          "actor.public-authority-candidate.synthetic"
        ],
        "channel_description": "Synthetic dual-recipient route. No live channel or response service exists.",
        "effect": "pause-and-record-only"
      }
    }
  ],
  "deliberation_scope": {
    "position_ids": [
      "position.affected-workers.synthetic",
      "position.worker-households.synthetic",
      "position.transition-provider.synthetic",
      "position.public-authority.synthetic"
    ],
    "dissent_ids": [
      "dissent.household-continuity.synthetic"
    ],
    "unresolved_dissent_ids": [
      "dissent.household-continuity.synthetic"
    ]
  },
  "if_binding": {
    "condition_definition_ref": {
      "condition_id": "condition.worker-option.nsw",
      "definition_version": "1.0.0",
      "definition_hash": "sha256:f5e2e2a299529dc890c70ef36b2e95ba9408b0e6a4d76a249b8b60810e9781e2"
    },
    "evaluation_receipt_ref": {
      "receipt_id": "receipt.condition.worker-option.nsw.20260909",
      "receipt_version": "1.0.0",
      "receipt_hash": "sha256:c91bc7c580ce1d902dfc8e10e61a434be89b83b2d5ca5cbd83d63081512132df",
      "condition_id": "condition.worker-option.nsw",
      "definition_version": "1.0.0",
      "definition_hash": "sha256:f5e2e2a299529dc890c70ef36b2e95ba9408b0e6a4d76a249b8b60810e9781e2",
      "evaluated_at": "2026-09-09T00:00:00Z",
      "valid_until": "2026-10-09T00:00:00Z",
      "mechanically_valid_for_evaluation": true,
      "computed_rule_state": "true",
      "empirical_truth_established": false,
      "authority_effect": "none",
      "action_authorised": false
    },
    "effect": "eligibility-only-not-truth-or-authority"
  },
  "boundaries": {
    "empirical_truth_established": false,
    "affected_party_consent_established": false,
    "authority_verified": false,
    "action_authorised": false,
    "publication_approved": false
  },
  "context_hash": "sha256:0dc355680468b001808119c714ebb71cfa4406d4ca0fc8a7cedf373034a50234"
}
